{
  "schemaVersion": "0.2.0",
  "inventoryId": "research-mobile-llm-2026-09-17",
  "generatedAt": "2026-09-16T20:20:04.000Z",
  "records": [
    {
      "pocId": "poc-nvidia-parakeet-tdt-0-6b-v3",
      "modelId": "nvidia/parakeet-tdt-0.6b-v3",
      "modelRevision": "541d1f99c6b0c3cd0b11a95167540bb8edefd82b",
      "fixtureId": "text-generation/basic-v1",
      "ios": {
        "runtime": "core-ai",
        "status": "blocked",
        "harnessPath": "pocs/cross-platform-adapter/runner.mjs",
        "reason": "Core AI POC blocked: requires Xcode/iOS 27 and an available physical iPhone; observed Xcode 26.4.1\nBuild version 17E202."
      },
      "android": {
        "runtime": "executorch",
        "status": "blocked",
        "harnessPath": "pocs/cross-platform-adapter/runner.mjs",
        "reason": "ExecuTorch POC blocked: requires Android SDK/adb and an available physical Android device; observed ADB is unavailable or no Android device is connected; no device evidence was fabricated."
      }
    },
    {
      "pocId": "poc-qwen-qwen3-vl-2b-instruct",
      "modelId": "Qwen/Qwen3-VL-2B-Instruct",
      "modelRevision": "89644892e4d85e24eaac8bacfd4f463576704203",
      "fixtureId": "text-generation/basic-v1",
      "ios": {
        "runtime": "core-ai",
        "status": "blocked",
        "harnessPath": "pocs/cross-platform-adapter/runner.mjs",
        "reason": "Core AI POC blocked: requires Xcode/iOS 27 and an available physical iPhone; observed Xcode 26.4.1\nBuild version 17E202."
      },
      "android": {
        "runtime": "executorch",
        "status": "blocked",
        "harnessPath": "pocs/cross-platform-adapter/runner.mjs",
        "reason": "ExecuTorch POC blocked: requires Android SDK/adb and an available physical Android device; observed ADB is unavailable or no Android device is connected; no device evidence was fabricated."
      }
    },
    {
      "pocId": "poc-openai-whisper-large-v3-turbo",
      "modelId": "openai/whisper-large-v3-turbo",
      "modelRevision": "41f01f3fe87f28c78e2fbf8b568835947dd65ed9",
      "fixtureId": "text-generation/basic-v1",
      "ios": {
        "runtime": "core-ai",
        "status": "blocked",
        "harnessPath": "pocs/cross-platform-adapter/runner.mjs",
        "reason": "Core AI POC blocked: requires Xcode/iOS 27 and an available physical iPhone; observed Xcode 26.4.1\nBuild version 17E202."
      },
      "android": {
        "runtime": "executorch",
        "status": "blocked",
        "harnessPath": "pocs/cross-platform-adapter/runner.mjs",
        "reason": "ExecuTorch POC blocked: requires Android SDK/adb and an available physical Android device; observed ADB is unavailable or no Android device is connected; no device evidence was fabricated."
      }
    }
  ]
}
